{
  "schema_version": "v0.1",
  "evidence_id": "01_part_selection_visual_evidence",
  "items": [
    {
      "id": "mallet_hammer_whole_mesh_part_choice_overview",
      "kind": "whole_mesh_part_choice_overview",
      "media_type": "image",
      "path": "configs/tool_refs/mallet_hammer/evidence/01_part_selection/mallet_hammer/overview/mallet_hammer_whole_mesh_part_choice_overview.png",
      "description": "Multi-view whole-mesh SAMPart3D part candidates for mallet_hammer; each part is shown as a colored overlay on the mesh, with the same anonymous marker ID reused across views.",
      "provider_id": "sampart3d_part_role_evidence",
      "source_stage": "offline_tool_part_visualization",
      "allowed_use": "planning_context"
    },
    {
      "id": "mallet_hammer_isolated_part_choice_overview",
      "kind": "isolated_part_choice_overview",
      "media_type": "image",
      "path": "configs/tool_refs/mallet_hammer/evidence/01_part_selection/mallet_hammer/overview/mallet_hammer_isolated_part_choice_overview.png",
      "description": "Isolated SAMPart3D part candidates for mallet_hammer; auxiliary debug view.",
      "provider_id": "sampart3d_part_role_evidence",
      "source_stage": "offline_tool_part_visualization",
      "allowed_use": "debug_only"
    },
    {
      "id": "mallet_hammer_part_candidate_1_isolated_card",
      "kind": "isolated_part_card",
      "media_type": "image",
      "path": "configs/tool_refs/mallet_hammer/evidence/01_part_selection/mallet_hammer/part_cards/candidate_001_card.png",
      "part_marker": "1",
      "description": "Isolated SAMPart3D part candidate 1 for mallet_hammer; auxiliary debug view.",
      "provider_id": "sampart3d_part_role_evidence",
      "source_stage": "offline_tool_part_visualization",
      "allowed_use": "debug_only"
    },
    {
      "id": "mallet_hammer_part_candidate_2_isolated_card",
      "kind": "isolated_part_card",
      "media_type": "image",
      "path": "configs/tool_refs/mallet_hammer/evidence/01_part_selection/mallet_hammer/part_cards/candidate_002_card.png",
      "part_marker": "2",
      "description": "Isolated SAMPart3D part candidate 2 for mallet_hammer; auxiliary debug view.",
      "provider_id": "sampart3d_part_role_evidence",
      "source_stage": "offline_tool_part_visualization",
      "allowed_use": "debug_only"
    },
    {
      "id": "mallet_hammer_part_candidate_3_isolated_card",
      "kind": "isolated_part_card",
      "media_type": "image",
      "path": "configs/tool_refs/mallet_hammer/evidence/01_part_selection/mallet_hammer/part_cards/candidate_003_card.png",
      "part_marker": "3",
      "description": "Isolated SAMPart3D part candidate 3 for mallet_hammer; auxiliary debug view.",
      "provider_id": "sampart3d_part_role_evidence",
      "source_stage": "offline_tool_part_visualization",
      "allowed_use": "debug_only"
    },
    {
      "id": "mallet_hammer_part_candidate_4_isolated_card",
      "kind": "isolated_part_card",
      "media_type": "image",
      "path": "configs/tool_refs/mallet_hammer/evidence/01_part_selection/mallet_hammer/part_cards/candidate_004_card.png",
      "part_marker": "4",
      "description": "Isolated SAMPart3D part candidate 4 for mallet_hammer; auxiliary debug view.",
      "provider_id": "sampart3d_part_role_evidence",
      "source_stage": "offline_tool_part_visualization",
      "allowed_use": "debug_only"
    },
    {
      "id": "mallet_hammer_part_candidate_5_isolated_card",
      "kind": "isolated_part_card",
      "media_type": "image",
      "path": "configs/tool_refs/mallet_hammer/evidence/01_part_selection/mallet_hammer/part_cards/candidate_005_card.png",
      "part_marker": "5",
      "description": "Isolated SAMPart3D part candidate 5 for mallet_hammer; auxiliary debug view.",
      "provider_id": "sampart3d_part_role_evidence",
      "source_stage": "offline_tool_part_visualization",
      "allowed_use": "debug_only"
    }
  ],
  "metadata": {
    "evidence_kind": "sampart3d_part_overview_only",
    "contact_marker_table_scope": "all_parts_precomputed",
    "selected_contact_point_markers_by_tool": {},
    "selected_contact_point_markers_default": [],
    "part_role_selection_path": null,
    "region_marker_table": [
      {
        "tool_id": "mallet_hammer",
        "marker": "1",
        "part_id": "part_000",
        "part_ref": "tool.parts.part_000",
        "source_label": "p3sam_segment_0",
        "point_count": 5031,
        "role_candidates": [
          "tool_part_candidate",
          "functional_candidate",
          "grasp_candidate",
          "contact_patch"
        ],
        "part_label": 0
      },
      {
        "tool_id": "mallet_hammer",
        "marker": "2",
        "part_id": "part_078",
        "part_ref": "tool.parts.part_078",
        "source_label": "p3sam_segment_78",
        "point_count": 3395,
        "role_candidates": [
          "tool_part_candidate",
          "functional_candidate",
          "contact_patch"
        ],
        "part_label": 78
      },
      {
        "tool_id": "mallet_hammer",
        "marker": "3",
        "part_id": "part_283",
        "part_ref": "tool.parts.part_283",
        "source_label": "p3sam_segment_283",
        "point_count": 190,
        "role_candidates": [
          "tool_part_candidate",
          "functional_candidate",
          "fine_feature_candidate",
          "contact_patch"
        ],
        "part_label": 283
      },
      {
        "tool_id": "mallet_hammer",
        "marker": "4",
        "part_id": "part_287",
        "part_ref": "tool.parts.part_287",
        "source_label": "p3sam_segment_287",
        "point_count": 1091,
        "role_candidates": [
          "tool_part_candidate",
          "functional_candidate",
          "contact_patch"
        ],
        "part_label": 287
      },
      {
        "tool_id": "mallet_hammer",
        "marker": "5",
        "part_id": "part_290",
        "part_ref": "tool.parts.part_290",
        "source_label": "p3sam_segment_290",
        "point_count": 438,
        "role_candidates": [
          "tool_part_candidate",
          "functional_candidate",
          "contact_patch"
        ],
        "part_label": 290
      }
    ],
    "contact_marker_table": [],
    "usage": "The whole-mesh part-choice overview exposes anonymous SAMPart3D regions in full-tool context as one multi-view sheet with colored part overlays for contact-region selection. Isolated cards are auxiliary debug views. After a part is selected, the renderer emits a selected-part bbox overview plus one selected-part face-highlight card per F marker; each face card shows the bbox, one highlighted bbox face, the contact point, and the surface normal/motion-axis arrow. This renderer must not emit legacy per-face/contact-choice paths."
  }
}
