{
  "schema_version": "v0.1",
  "evidence_id": "01_part_selection_visual_evidence",
  "items": [
    {
      "id": "long_screwdriver_whole_mesh_part_choice_overview",
      "kind": "whole_mesh_part_choice_overview",
      "media_type": "image",
      "path": "configs/tool_refs/long_screwdriver/evidence/01_part_selection/long_screwdriver/overview/long_screwdriver_whole_mesh_part_choice_overview.png",
      "description": "Multi-view whole-mesh SAMPart3D part candidates for long_screwdriver; each part is shown as a colored overlay on the mesh, with the same anonymous marker ID reused across views.",
      "provider_id": "sampart3d_part_role_evidence",
      "source_stage": "offline_tool_part_visualization",
      "allowed_use": "planning_context"
    },
    {
      "id": "long_screwdriver_isolated_part_choice_overview",
      "kind": "isolated_part_choice_overview",
      "media_type": "image",
      "path": "configs/tool_refs/long_screwdriver/evidence/01_part_selection/long_screwdriver/overview/long_screwdriver_isolated_part_choice_overview.png",
      "description": "Isolated SAMPart3D part candidates for long_screwdriver; auxiliary debug view.",
      "provider_id": "sampart3d_part_role_evidence",
      "source_stage": "offline_tool_part_visualization",
      "allowed_use": "debug_only"
    },
    {
      "id": "long_screwdriver_part_candidate_1_isolated_card",
      "kind": "isolated_part_card",
      "media_type": "image",
      "path": "configs/tool_refs/long_screwdriver/evidence/01_part_selection/long_screwdriver/part_cards/candidate_001_card.png",
      "part_marker": "1",
      "description": "Isolated SAMPart3D part candidate 1 for long_screwdriver; auxiliary debug view.",
      "provider_id": "sampart3d_part_role_evidence",
      "source_stage": "offline_tool_part_visualization",
      "allowed_use": "debug_only"
    },
    {
      "id": "long_screwdriver_part_candidate_2_isolated_card",
      "kind": "isolated_part_card",
      "media_type": "image",
      "path": "configs/tool_refs/long_screwdriver/evidence/01_part_selection/long_screwdriver/part_cards/candidate_002_card.png",
      "part_marker": "2",
      "description": "Isolated SAMPart3D part candidate 2 for long_screwdriver; auxiliary debug view.",
      "provider_id": "sampart3d_part_role_evidence",
      "source_stage": "offline_tool_part_visualization",
      "allowed_use": "debug_only"
    },
    {
      "id": "long_screwdriver_part_candidate_3_isolated_card",
      "kind": "isolated_part_card",
      "media_type": "image",
      "path": "configs/tool_refs/long_screwdriver/evidence/01_part_selection/long_screwdriver/part_cards/candidate_003_card.png",
      "part_marker": "3",
      "description": "Isolated SAMPart3D part candidate 3 for long_screwdriver; auxiliary debug view.",
      "provider_id": "sampart3d_part_role_evidence",
      "source_stage": "offline_tool_part_visualization",
      "allowed_use": "debug_only"
    },
    {
      "id": "long_screwdriver_part_candidate_4_isolated_card",
      "kind": "isolated_part_card",
      "media_type": "image",
      "path": "configs/tool_refs/long_screwdriver/evidence/01_part_selection/long_screwdriver/part_cards/candidate_004_card.png",
      "part_marker": "4",
      "description": "Isolated SAMPart3D part candidate 4 for long_screwdriver; auxiliary debug view.",
      "provider_id": "sampart3d_part_role_evidence",
      "source_stage": "offline_tool_part_visualization",
      "allowed_use": "debug_only"
    },
    {
      "id": "long_screwdriver_part_candidate_5_isolated_card",
      "kind": "isolated_part_card",
      "media_type": "image",
      "path": "configs/tool_refs/long_screwdriver/evidence/01_part_selection/long_screwdriver/part_cards/candidate_005_card.png",
      "part_marker": "5",
      "description": "Isolated SAMPart3D part candidate 5 for long_screwdriver; auxiliary debug view.",
      "provider_id": "sampart3d_part_role_evidence",
      "source_stage": "offline_tool_part_visualization",
      "allowed_use": "debug_only"
    }
  ],
  "metadata": {
    "evidence_kind": "sampart3d_part_overview_only",
    "contact_marker_table_scope": "all_parts_precomputed",
    "selected_contact_point_markers_by_tool": {},
    "selected_contact_point_markers_default": [],
    "part_role_selection_path": null,
    "region_marker_table": [
      {
        "tool_id": "long_screwdriver",
        "marker": "1",
        "part_id": "part_000",
        "part_ref": "tool.parts.part_000",
        "source_label": "p3sam_segment_0",
        "point_count": 876,
        "role_candidates": [
          "tool_part_candidate",
          "functional_candidate",
          "grasp_candidate",
          "contact_patch"
        ],
        "part_label": 0
      },
      {
        "tool_id": "long_screwdriver",
        "marker": "2",
        "part_id": "part_001",
        "part_ref": "tool.parts.part_001",
        "source_label": "p3sam_segment_9",
        "point_count": 2552,
        "role_candidates": [
          "tool_part_candidate",
          "functional_candidate",
          "grasp_candidate",
          "contact_patch"
        ],
        "part_label": 9
      },
      {
        "tool_id": "long_screwdriver",
        "marker": "3",
        "part_id": "part_002",
        "part_ref": "tool.parts.part_002",
        "source_label": "p3sam_segment_232",
        "point_count": 496,
        "role_candidates": [
          "tool_part_candidate",
          "functional_candidate",
          "contact_patch"
        ],
        "part_label": 232
      },
      {
        "tool_id": "long_screwdriver",
        "marker": "4",
        "part_id": "part_003",
        "part_ref": "tool.parts.part_003",
        "source_label": "p3sam_segment_293",
        "point_count": 1137,
        "role_candidates": [
          "tool_part_candidate",
          "functional_candidate",
          "contact_patch"
        ],
        "part_label": 293
      },
      {
        "tool_id": "long_screwdriver",
        "marker": "5",
        "part_id": "part_004",
        "part_ref": "tool.parts.part_004",
        "source_label": "p3sam_segment_354",
        "point_count": 503,
        "role_candidates": [
          "tool_part_candidate",
          "functional_candidate",
          "contact_patch"
        ],
        "part_label": 354
      }
    ],
    "contact_marker_table": [],
    "usage": "The whole-mesh part-choice overview exposes anonymous SAMPart3D regions in full-tool context as one multi-view sheet with colored part overlays for contact-region selection. Isolated cards are auxiliary debug views. After a part is selected, the renderer emits a selected-part bbox overview plus one selected-part face-highlight card per F marker; each face card shows the bbox, one highlighted bbox face, the contact point, and the surface normal/motion-axis arrow. This renderer must not emit legacy per-face/contact-choice paths."
  }
}
